{
  "$schema": "../../schema/substance.schema.json",
  "key": "sermorelin",
  "name": "Sermorelin",
  "aka": [
    "GHRH(1-29)",
    "Geref"
  ],
  "class": "GHRH analogue",
  "category": "peptide",
  "regulatory_status": "rx_compounded",
  "routes": [
    "subcutaneous"
  ],
  "typical_dose_shape": {
    "amount_low": 100,
    "amount_high": 500,
    "unit": "mcg",
    "cadence": "daily",
    "note": "No FDA-approved dosing reference exists for this compound. This range describes reported use and is not a recommendation."
  },
  "description": "A 29-amino-acid fragment of growth hormone-releasing hormone. The former US product (Geref) was withdrawn from marketing; material in current use is supplied through compounding pharmacies rather than as an approved product.",
  "systems": [
    {
      "key": "pituitary",
      "relation": "acts_on",
      "note": "Stimulates somatotroph GH release; placed on the pituitary by intended effect.",
      "evidence": [
        "pubmed:34665524",
        "pubmed:2429796",
        "curation:sermorelin"
      ]
    },
    {
      "key": "body",
      "relation": "acts_on",
      "note": "Sought for its downstream anabolic and body-composition effect.",
      "evidence": [
        "curation:sermorelin"
      ]
    },
    {
      "key": "pancreas",
      "relation": "burdens",
      "note": "Raised GH exposure antagonises insulin action.",
      "evidence": [
        "curation:sermorelin"
      ]
    }
  ],
  "monitors": [
    {
      "marker_key": "igf1",
      "why": "The only practical index of achieved GH exposure.",
      "cadence_days": 90,
      "evidence": [
        "pubmed:34665524",
        "pubmed:2429796",
        "curation:sermorelin"
      ]
    },
    {
      "marker_key": "glucose_fasting",
      "why": "GH-induced insulin resistance.",
      "cadence_days": 180,
      "evidence": [
        "curation:sermorelin"
      ]
    }
  ],
  "sources": [
    {
      "id": "curation:sermorelin",
      "kind": "own_curation",
      "license": "own-curation",
      "url": "https://github.com/geekdojo/substance-catalog",
      "title": "substance-catalog hand curation: Sermorelin",
      "retrieved": "2026-08-23",
      "note": "Original curation by this repository: system placement, relation type, monitoring marker choice and cadence. No third-party text is reproduced."
    },
    {
      "id": "pubmed:2429796",
      "kind": "pubmed",
      "license": "own-curation",
      "url": "https://pubmed.ncbi.nlm.nih.gov/2429796/",
      "title": "Growth hormone releasing hormone.",
      "retrieved": "2026-08-23",
      "note": "PMID 2429796 (Clin Endocrinol Metab, 1986 Aug) identifies literature consulted for this hand-curated entry. No source text is reproduced; the catalog value is original curation."
    },
    {
      "id": "pubmed:34665524",
      "kind": "pubmed",
      "license": "own-curation",
      "url": "https://pubmed.ncbi.nlm.nih.gov/34665524/",
      "title": "Advances in the detection of growth hormone releasing hormone synthetic analogs.",
      "retrieved": "2026-08-23",
      "note": "PMID 34665524 (Drug Test Anal, 2021 Nov) identifies literature consulted for this hand-curated entry. No source text is reproduced; the catalog value is original curation."
    }
  ],
  "source_gaps": [
    {
      "source": "openfda_spl",
      "queried": "sermorelin",
      "result": "no_rows",
      "checked": "2026-08-23"
    },
    {
      "source": "livertox",
      "queried": "Sermorelin",
      "result": "no_rows",
      "checked": "2026-08-23"
    },
    {
      "source": "unitox",
      "queried": "Sermorelin acetate",
      "result": "no_rows",
      "checked": "2026-08-23"
    },
    {
      "source": "dilirank",
      "queried": "Sermorelin",
      "result": "no_rows",
      "checked": "2026-08-23"
    }
  ],
  "valid_from": "2026-08-23",
  "valid_to": null
}
