{
  "$schema": "../../schema/substance.schema.json",
  "key": "zolpidem",
  "name": "Zolpidem",
  "aka": [
    "Ambien",
    "Edluar",
    "Intermezzo"
  ],
  "class": "Non-benzodiazepine GABA-A positive allosteric modulator (Schedule IV)",
  "category": "prescription",
  "regulatory_status": "fda_approved",
  "routes": [
    "oral",
    "sublingual"
  ],
  "typical_dose_shape": {
    "amount_low": 5,
    "amount_high": 10,
    "unit": "mg",
    "cadence": "daily"
  },
  "description": "A non-benzodiazepine hypnotic selective for the alpha-1 subunit of the GABA-A receptor, approved for short-term treatment of insomnia. Carries a boxed warning for complex sleep behaviours.",
  "systems": [
    {
      "key": "brain",
      "relation": "acts_on",
      "note": "GABA-A positive allosteric modulation producing sedation; the labelled indication.",
      "evidence": [
        "openfda:021153ce-fe27-4ed1-8d88-b4157b0ed734",
        "livertox:NBK547962"
      ]
    },
    {
      "key": "liver",
      "relation": "burdens",
      "note": "Hepatically metabolised; dose reduction is labelled in hepatic impairment.",
      "evidence": [
        "openfda:021153ce-fe27-4ed1-8d88-b4157b0ed734",
        "livertox:NBK547962",
        "unitox:ZOLPIDEM TARTRATE"
      ]
    }
  ],
  "monitors": [
    {
      "marker_key": "alt",
      "why": "Labelled dose reduction in hepatic impairment.",
      "cadence_days": 365,
      "evidence": [
        "openfda:021153ce-fe27-4ed1-8d88-b4157b0ed734",
        "livertox:NBK547962"
      ]
    },
    {
      "marker_key": "who5",
      "why": "Boxed complex sleep behaviours and labelled next-day impairment.",
      "cadence_days": 180,
      "evidence": [
        "openfda:021153ce-fe27-4ed1-8d88-b4157b0ed734"
      ]
    }
  ],
  "sources": [
    {
      "id": "curation:zolpidem",
      "kind": "own_curation",
      "license": "own-curation",
      "url": "https://github.com/geekdojo/substance-catalog",
      "title": "substance-catalog hand curation: Zolpidem",
      "retrieved": "2026-08-23",
      "note": "Original curation by this repository: system placement, relation type, monitoring marker choice and cadence. No third-party text is reproduced."
    },
    {
      "id": "dilirank:LT00164",
      "kind": "dilirank",
      "license": "public-domain",
      "url": "https://www.fda.gov/science-research/liver-toxicity-knowledge-base-ltkb/drug-induced-liver-injury-rank-dilirank-20-dataset",
      "title": "DILIrank 2.0 — Drug Induced Liver Injury Rank dataset",
      "retrieved": "2026-08-23",
      "note": "DILIrank 2.0 row LT00164 \"Zolpidem tartrate\": Ambiguous-DILI-concern (severity class 7). FDA-authored, public domain. Consulted, not cited: this classification does not support a hepatic burden claim."
    },
    {
      "id": "livertox:NBK547962",
      "kind": "livertox",
      "license": "public-domain",
      "url": "https://www.ncbi.nlm.nih.gov/books/NBK547962/",
      "title": "LiverTox: Zolpidem",
      "retrieved": "2026-08-23",
      "note": "LiverTox, NIDDK, NCBI Bookshelf. The publication is in the public domain."
    },
    {
      "id": "openfda:021153ce-fe27-4ed1-8d88-b4157b0ed734",
      "kind": "openfda_spl",
      "license": "CC0-1.0",
      "url": "https://dailymed.nlm.nih.gov/dailymed/drugInfo.cfm?setid=021153ce-fe27-4ed1-8d88-b4157b0ed734",
      "title": "FDA Structured Product Label: Zolpidem",
      "retrieved": "2026-08-23",
      "note": "openFDA drug/label SPL set id 021153ce-fe27-4ed1-8d88-b4157b0ed734, effective 20231116. 117 label record(s) matched."
    },
    {
      "id": "unitox:ZOLPIDEM TARTRATE",
      "kind": "unitox",
      "license": "CC-BY-4.0",
      "url": "https://doi.org/10.5281/zenodo.14042913",
      "title": "UniTox: Unified Dataset of Drug-Induced Toxicity from FDA Labels",
      "retrieved": "2026-08-23",
      "note": "UniTox row \"ZOLPIDEM TARTRATE\". Ternary ratings — cardio:Less, liver:Most, renal:No, heme:Less, fertility:Less, pulm:Most, oto:No, derm:Less. Silberg, Simon, Swanson & Zou (Stanford), CC BY 4.0."
    }
  ],
  "valid_from": "2026-08-23",
  "valid_to": null
}
