{
  "$schema": "../../schema/substance.schema.json",
  "key": "cerebrolysin",
  "name": "Cerebrolysin",
  "aka": [
    "FPF-1070"
  ],
  "class": "Porcine brain-derived peptide preparation",
  "category": "nootropic",
  "regulatory_status": "research_chemical",
  "routes": [
    "intramuscular",
    "intravenous"
  ],
  "typical_dose_shape": {
    "amount_low": 5,
    "amount_high": 30,
    "unit": "mL",
    "cadence": "daily",
    "note": "No FDA-approved dosing reference exists for this compound. This range describes reported use and is not a recommendation."
  },
  "description": "A preparation of low-molecular-weight peptides and amino acids produced by enzymatic breakdown of porcine brain tissue, registered in several countries for stroke and dementia. It has no FDA approval and is not a defined single molecule. Registered in several non-US jurisdictions. No FDA approval. Not a single defined molecular entity.",
  "systems": [
    {
      "key": "brain",
      "relation": "acts_on",
      "note": "Taken for neurotrophic and neuroprotective effect; the intended effect.",
      "evidence": [
        "pubmed:37052231",
        "pubmed:22514795",
        "curation:cerebrolysin"
      ]
    },
    {
      "key": "liver",
      "relation": "burdens",
      "note": "A biological preparation of undefined composition without US labelling.",
      "evidence": [
        "curation:cerebrolysin"
      ]
    },
    {
      "key": "blood",
      "relation": "burdens",
      "note": "Porcine-derived biological with an inherent hypersensitivity concern.",
      "evidence": [
        "curation:cerebrolysin"
      ]
    }
  ],
  "monitors": [
    {
      "marker_key": "alt",
      "why": "Undefined biological preparation without US safety labelling.",
      "cadence_days": 180,
      "evidence": [
        "curation:cerebrolysin"
      ]
    },
    {
      "marker_key": "who5",
      "why": "The accessible instrument for the cognitive and affective effect claimed.",
      "cadence_days": 90,
      "evidence": [
        "curation:cerebrolysin"
      ]
    }
  ],
  "sources": [
    {
      "id": "curation:cerebrolysin",
      "kind": "own_curation",
      "license": "own-curation",
      "url": "https://github.com/geekdojo/human-system-substance-catalog",
      "title": "human-system-substance-catalog hand curation: Cerebrolysin",
      "retrieved": "2026-08-23",
      "note": "Original curation by this repository: system placement, relation type, monitoring marker choice and cadence. No third-party text is reproduced."
    },
    {
      "id": "pubmed:22514795",
      "kind": "pubmed",
      "license": "own-curation",
      "url": "https://pubmed.ncbi.nlm.nih.gov/22514795/",
      "title": "Safety profile of Cerebrolysin: clinical experience from dementia and stroke trials.",
      "retrieved": "2026-08-23",
      "note": "PMID 22514795 (Drugs Today (Barc), 2012 Apr) identifies literature consulted for this hand-curated entry. No source text is reproduced; the catalog value is original curation."
    },
    {
      "id": "pubmed:37052231",
      "kind": "pubmed",
      "license": "own-curation",
      "url": "https://pubmed.ncbi.nlm.nih.gov/37052231/",
      "title": "Modulation of neurotrophic factors in the treatment of dementia, stroke and TBI: Effects of Cerebrolysin.",
      "retrieved": "2026-08-23",
      "note": "PMID 37052231 (Med Res Rev, 2023 Sep) identifies literature consulted for this hand-curated entry. No source text is reproduced; the catalog value is original curation."
    }
  ],
  "source_gaps": [
    {
      "source": "openfda_spl",
      "queried": "cerebrolysin",
      "result": "no_rows",
      "checked": "2026-08-23"
    },
    {
      "source": "unitox",
      "queried": "Cerebrolysin",
      "result": "no_rows",
      "checked": "2026-08-23"
    }
  ],
  "valid_from": "2026-08-23",
  "valid_to": null
}
