{
  "$schema": "../../schema/substance.schema.json",
  "key": "pt_141",
  "name": "Bremelanotide",
  "aka": [
    "PT-141",
    "Vyleesi"
  ],
  "class": "Melanocortin-4 receptor agonist",
  "category": "peptide",
  "regulatory_status": "fda_approved",
  "routes": [
    "subcutaneous"
  ],
  "typical_dose_shape": {
    "amount_low": 1.75,
    "amount_high": 1.75,
    "unit": "mg",
    "cadence": "as_needed"
  },
  "description": "A melanocortin receptor agonist approved as Vyleesi for acquired generalised hypoactive sexual desire disorder in premenopausal women. Use in men is off-label.",
  "systems": [
    {
      "key": "brain",
      "relation": "acts_on",
      "note": "Central melanocortin-4 receptor agonism is the labelled mechanism; placed on the brain by intended effect rather than on the gonads.",
      "evidence": [
        "openfda:f1d0c1b5-2f39-4bad-a6a4-0066e3ad5dcf",
        "livertox:NBK573221"
      ]
    },
    {
      "key": "heart",
      "relation": "burdens",
      "note": "Transient blood pressure rise and heart rate reduction are labelled.",
      "evidence": [
        "openfda:f1d0c1b5-2f39-4bad-a6a4-0066e3ad5dcf",
        "unitox:BREMELANOTIDE"
      ]
    },
    {
      "key": "liver",
      "relation": "burdens",
      "note": "Transaminase movement is reported.",
      "evidence": [
        "livertox:NBK573221",
        "unitox:BREMELANOTIDE"
      ]
    }
  ],
  "monitors": [
    {
      "marker_key": "alt",
      "why": "Reported transaminase movement.",
      "cadence_days": 365,
      "evidence": [
        "livertox:NBK573221"
      ]
    }
  ],
  "sources": [
    {
      "id": "curation:pt_141",
      "kind": "own_curation",
      "license": "own-curation",
      "url": "https://github.com/geekdojo/human-system-substance-catalog",
      "title": "human-system-substance-catalog hand curation: Bremelanotide",
      "retrieved": "2026-08-23",
      "note": "Original curation by this repository: system placement, relation type, monitoring marker choice and cadence. No third-party text is reproduced."
    },
    {
      "id": "dilirank:LT03638",
      "kind": "dilirank",
      "license": "public-domain",
      "url": "https://www.fda.gov/science-research/liver-toxicity-knowledge-base-ltkb/drug-induced-liver-injury-rank-dilirank-20-dataset",
      "title": "DILIrank 2.0 — Drug Induced Liver Injury Rank dataset",
      "retrieved": "2026-08-23",
      "note": "DILIrank 2.0 row LT03638 \"Bremelanotide acetate\": Ambiguous-DILI-concern (severity class 4). FDA-authored, public domain. Consulted, not cited: this classification does not support a hepatic burden claim."
    },
    {
      "id": "livertox:NBK573221",
      "kind": "livertox",
      "license": "public-domain",
      "url": "https://www.ncbi.nlm.nih.gov/books/NBK573221/",
      "title": "LiverTox: Bremelanotide",
      "retrieved": "2026-08-23",
      "note": "LiverTox, NIDDK, NCBI Bookshelf. The publication is in the public domain."
    },
    {
      "id": "openfda:f1d0c1b5-2f39-4bad-a6a4-0066e3ad5dcf",
      "kind": "openfda_spl",
      "license": "CC0-1.0",
      "url": "https://dailymed.nlm.nih.gov/dailymed/drugInfo.cfm?setid=f1d0c1b5-2f39-4bad-a6a4-0066e3ad5dcf",
      "title": "FDA Structured Product Label: Vyleesi",
      "retrieved": "2026-08-23",
      "note": "openFDA drug/label SPL set id f1d0c1b5-2f39-4bad-a6a4-0066e3ad5dcf, effective 20251113. 1 label record(s) matched."
    },
    {
      "id": "unitox:BREMELANOTIDE",
      "kind": "unitox",
      "license": "CC-BY-4.0",
      "url": "https://doi.org/10.5281/zenodo.14042913",
      "title": "UniTox: Unified Dataset of Drug-Induced Toxicity from FDA Labels",
      "retrieved": "2026-08-23",
      "note": "UniTox row \"BREMELANOTIDE\". Ternary ratings — cardio:Most, liver:Less, renal:Less, heme:No, fertility:No, pulm:No, oto:No, derm:Most. Silberg, Simon, Swanson & Zou (Stanford), CC BY 4.0."
    }
  ],
  "valid_from": "2026-08-23",
  "valid_to": null
}
